"Id","Name","Lat","Lng","Rating","Nb_Rating","Type"
"ChIJbxYWKo1t5kcRPDLvE8D_aEA","Avenue Circulaire","48.8627354","2.3898839",NA,NA,"route"
"ChIJZU3PDn9y5kcRFeMRtE7KDMI","MG PARIS KINE - Graziani Michel","48.863223","2.389301","4.2","80","physiotherapist health point_of_interest establishment"
"ChIJL6zNsatt5kcR1Fc2IzuwssY","YO' Mac And Cheese","48.8632231","2.3893007","5","37","restaurant food point_of_interest establishment"
"ChIJNyML2vJt5kcR2gZPRwvGPGg","Flom Joseph","48.8632231","2.3893007",NA,NA,"doctor health point_of_interest establishment"
"ChIJNyML2vJt5kcRiw3i1SW485s","Servadio Albert","48.8632231","2.3893007",NA,NA,"doctor health point_of_interest establishment"
"ChIJNSSUMI1t5kcR_bOBI92UjrU","Maryline Guitton","48.863231","2.3892685",NA,NA,"school health point_of_interest establishment"
"ChIJocZt4fJt5kcRIvixZcK90sk","Soumaré Dieyinabou","48.863231","2.3892685",NA,NA,"point_of_interest establishment"
"ChIJD7fiBh9u5kcRYJSMaMOCCwQ","Paris","48.856614","2.3522219",NA,NA,"locality political"
