"Id","Name","Lat","Lng","Rating","Nb_Rating","Type"
"ChIJg3dI6Ytt5kcRFoew-CI7q94","Chemin de la Bédoyère","48.8593413","2.3943587",NA,NA,"route"
"ChIJZe6alItt5kcR1_kKjPo8GKI","Tombe de Jim Morrison","48.8592666","2.3937884","4.2","1228","cemetery tourist_attraction point_of_interest establishment"
"ChIJN_Nvectt5kcRa2Y6RrPNVWg","Могила Джима Моррисона","48.8592064","2.3937399","5","3","tourist_attraction point_of_interest establishment"
"ChIJgbHMbYJt5kcRycCbgAT5YaU","Tomba di Jim Morrison","48.8593226","2.3938132",NA,NA,"point_of_interest establishment"
"ChIJUSbakott5kcR0geWSy4n09U","Tombe de Suzon Garrigues","48.8594811","2.393885",NA,NA,"point_of_interest establishment"
"ChIJD7fiBh9u5kcRYJSMaMOCCwQ","Paris","48.856614","2.3522219",NA,NA,"locality political"
