"Id","Name","Lat","Lng","Rating","Nb_Rating","Type"
"ChIJC20xULVt5kcRYRZ6I7DxaO0","Galerie de l'Ourcq","48.8950858","2.3931879",NA,NA,"route"
"ChIJE_JG49Bt5kcRk3HWxaSuJmg","La Péniche Cinéma","48.8951057","2.3923174","4.3","106","bar movie_theater point_of_interest establishment"
"ChIJ23EArMpt5kcRQrUWLEriCOI","Euro Dentaire","48.895226","2.3923748",NA,NA,"doctor health point_of_interest establishment"
"ChIJ23EArMpt5kcR9YSMLYyMRYY","A Ka Lize' Len","48.895226","2.3923748",NA,NA,"restaurant food point_of_interest establishment"
"ChIJD7fiBh9u5kcRYJSMaMOCCwQ","Paris","48.856614","2.3522219",NA,NA,"locality political"
