"Id","Name","Lat","Lng","Rating","Nb_Rating","Type"
"ChIJJwGNq7tt5kcRYN-H8eUISoI","27-25 Boulevard d'Algérie","48.882577","2.3998185",NA,NA,"route"
"ChIJ0XInOgNt5kcR22nASv5rFHo","Eve ou La femme au Bain","48.8825201","2.3994194",NA,NA,"point_of_interest establishment"
"ChIJTwxjk1Ft5kcR54VZf_G-Hgs","Fontaine du Chapeau Rouge","48.882527","2.3994385",NA,NA,"point_of_interest establishment"
"ChIJ6TKpwLtt5kcRNRLj5OlNl5M","Parc de la Butte-du-Chapeau-Rouge","48.8818522","2.3989611","4.2","1029","park tourist_attraction point_of_interest establishment"
"ChIJD7fiBh9u5kcRYJSMaMOCCwQ","Paris","48.856614","2.3522219",NA,NA,"locality political"
