"Id","Name","Lat","Lng","Rating","Nb_Rating","Type"
"ChIJD7fiBh9u5kcRYJSMaMOCCwQ","Paris","48.856614","2.3522219",NA,NA,"locality political"
"ChIJ6wm52fhu5kcRnVwFJOFa6gw","Bichat-Claude Bernard Hospital","48.8988449","2.3317094","2.7","519","hospital health point_of_interest establishment"
"ChIJAQAQwfhu5kcRuIIrVcUEavI","cohorte française de rétrécissement aortique","48.898709","2.331951",NA,NA,"point_of_interest establishment"
"ChIJAQAQwfhu5kcRT3cX8skfOTk","ChirVTT","48.89872","2.332565",NA,NA,"doctor health point_of_interest establishment"
"ChIJHT7S2fhu5kcRz1PFJrlDXL8","Angela Bergeret","48.8991197","2.3319984",NA,NA,"doctor health point_of_interest establishment"
"ChIJR7qxbk9v5kcRw5lZ1scSC90","Centre du Sommeil Bichat Louis Mourier","48.8988467","2.3323552","3","2","health point_of_interest establishment"
"ChIJYUYuWr1v5kcRiLLB4h6A6X8","Angélique KAZEMZADEH","48.8991197","2.3319984","5","1","health point_of_interest establishment"
"ChIJZamWt2Bu5kcRYBuUaMOCCwU","18th arrondissement of Paris","48.8915856","2.3495999",NA,NA,"sublocality_level_1 sublocality political"
